Company,Country,Email/Contact,Template,Fit,Status,Date contacted,Follow-up due,Notes
Bradshaw Taylor,UK,info@bradshawtaylor.com,B (DCTS),Medium,SENT,2026-07-13,2026-07-23,Also submit Sales form.
Khangri Sourcing,Nepal/US,info@khangrisourcing.com,Follow-up,High,SENT,2026-07-13,2026-07-23,CALL +977-1-4427191 for WhatsApp.
Sudara,USA,Info@sudara.org,C (ethics),Medium,SENT,2026-07-13,2026-07-23,Ethics angle.
Komodo,UK,mark@komodo.co.uk,B (DCTS),High,SENT,2026-07-14,2026-07-23,Uses Knitex Kathmandu + India. mark@ is direct.
Surya,Australia,info@surya.com.au,A/B,High,SENT,2026-07-14,2026-07-23,STRONG - all production in Nepal partners. Personalised email sent.
Ark Fair Trade,Canada,namaste@arkfairtrade.com,A,High,SENT,2026-07-14,2026-07-23,STRONG - buys Nepal cut-&-sew since 1985. Personalised email sent.
People Tree,UK,wholesale@peopletree.co.uk,B (DCTS),High,SENT,2026-07-20,2026-07-25,Fair-trade pioneer; already produces in NEPAL + India/BD.
Aiayu,Denmark,sales@aiayu.com,A,High,SENT,2026-07-20,2026-07-25,ALREADY makes in Nepal (SEDEX-certified workshop). Strong ethics fit.
Happy Earth Apparel,USA,help@happyearthapparel.com,C (ethics),High,SENT,2026-07-20,2026-07-25,Near-identical range (organic tees + fleece hoodies). Outsources India.
Tree of Life,Australia,customer@treeoflife.com.au,A/B,High,SENT,2026-07-20,2026-07-23,Large ~158pc Made-in-Nepal range. Fashion importer - fabric-agnostic. Sent.
Epsilon Global Sourcing,UK,epsilongs.com (contact form),Agent,High,SENT,2026-07-20,2026-07-23,Sourcing AGENT for knit tees/polos/fleece; fabric-agnostic. Sent via form.
Nomads Clothing,UK,info@nomadsclothing.co.uk,B (DCTS),High,TO SEND,,,Organic cotton jersey from South Asia; Nepal origin story.
Terra Thread,USA,terrathread@terrathread.com,C (ethics),High,TO SEND,,,Organic cotton tees; fair-trade; active wholesale.
Maggie's Organics,USA,info@maggiesorganics.com,C (ethics),High,TO SEND,,,Organic cotton tees/tanks; Fair Trade Federation.
ThokkThokk,Germany,andi@thokkthokk.com,A (EU),High,TO SEND,,,Printed organic tees/hoodies/sweats. andi@ = B2B contact.
GREEN SHIRTS,Germany,office@green-shirts.com,A (EU),High,TO SEND,,,Organic tees/hoodies own line + B2B custom. Multi-country.
Gecko Gearz,New Zealand,penny_betts@hotmail.com,A,High,TO SEND,,,25+ yrs Nepal sourcing; organic cotton tees. Personal email.
Cotton Roots,UK,sales@cottonroots.co.uk,B (DCTS),High,TO SEND,,,Ethical promo/workwear polos/tees/fleece. Fairtrade/Fair Wear.
Ganesh Himal Trading,USA,info@ganeshhimaltrading.com,C (ethics),High,TO SEND,,,Fair-trade wholesaler; imports Nepal cut-&-sew 20-30 yrs.
Dedicated Brand,Sweden,dedicatedbrand.com (form),A (EU),High,TO SEND,,,Exact product overlap (tees/sweats/hoodies). Find B2B contact.
tentree,Canada,tentree.com (wholesale form),A,High,TO SEND,,,Tees/hoodies/sweats; audited partners; CA duty-free.
Ethical Tee Company,UK,richard@ethicalteecompany.com,B (DCTS),Medium,TO SEND,,,CAUTION - needs GOTS+Fairwear audit. Real named contact.
The Good Tee,Canada,hello@thegoodtee.com,A,Medium,TO SEND,,,Exact category; committed to India - pitch as duty-free 2nd source.
Mata Traders,USA,wholesale@matatraders.com,C (ethics),Medium,TO SEND,,,Produces in Nepal cooperatives already. Wholesale email.
ARMEDANGELS,Germany,shop@armedangels.com,A (EU),Medium,TO SEND,,,Large EU eco brand; high compliance bar.
Mantra Wholesale,UK,info@mantrawholesale.com,B (DCTS),Medium,TO SEND,,,Imports cotton/fleece from Nepal+India; resells to retailers.
Thought,UK,info@wearethought.com,B (DCTS),Medium,TO SEND,,,Organic jersey basics; China-weighted - diversification pitch.
Known Supply,USA,supply@knownsupply.com,C (ethics),Medium,TO SEND,,,Ethical custom merch; Peru/Uganda. US not duty-free - ethics angle.
Kindred Apparel,Canada,team@kindredapparel.com,A,Medium,TO SEND,,,Canadian custom apparel; imports fair-trade cotton. CA duty-free.
Reflect Studio,Netherlands,hello@reflectstudio.com,A (EU),Medium,TO SEND,,,Fairtrade merch for NGOs/brands; has own Istanbul arm.
Norm Tekstil,Turkey,demireld@normltd.com.tr,A,High,SENT,2026-07-20,2026-07-23,Knitwear buying AGENT; fabric-agnostic; seeks duty-free EU alternatives. Sent.
KHQS International,India,sathish@khqsintl.com,Agent,High,SENT,2026-07-20,2026-07-23,Knit agent (lifestyle/performance labels); personalised sent to Sathish.
Impact Tailors,Spain,hello@impacttailors.com,A (EU),High,TO SEND,,,Hospitality uniforms; organic cotton + RECYCLED POLYESTER. Fabric-flexible.
Karlowsky Fashion,Germany,info@karlowsky.de,A (EU),High,TO SEND,,,Gastro/hotel workwear; knit polos/tees; BSCI. Blends standard.
Studio 104,UK,enquiries@studio-104.com,B (DCTS),High,TO SEND,,,Hotel/hospitality uniforms (polos/tees); outsources.
OCEANR,Ireland,info@oceanr.co,A (EU),High,TO SEND,,,Luxury hotel tech polos/tees - PERFORMANCE fabrics.
Afends,Australia,wholesale@afends.com,A/B,High,TO SEND,,,Streetwear; dedicated jersey & fleece sourcing; AU duty-free.
Plant Faced Clothing,UK,info@plantfacedclothing.com,B (DCTS),High,TO SEND,,,Vegan streetwear; organic+recycled; already makes in Bangladesh (LDC).
Firebrand Promotions,UK,sales@firebrandpromotions.co.uk,B (DCTS),High,TO SEND,,,B Corp merch; organic + RECYCLED POLYESTER. Fabric-flexible.
Essential Workwear,UK,essentialworkwear.com (form),B (DCTS),Medium,TO SEND,,,Workwear tees/polos/hoodies/fleece; organic + recycled poly.
Sustainable Better Merch,Sweden,order@sustainablebettermerch.com,A (EU),Medium,TO SEND,,,Band/festival merch tees & hoodies.
Vegan Outfitters,UK,info@veganoutfitters.com,B (DCTS),Medium,TO SEND,,,Vegan streetwear; organic + recycled cotton.
Picture Organic,France,picture-organic-clothing.com (form),A (EU),Medium,TO SEND,,,Outdoor; organic cotton + RECYCLED POLY. Larger buyer.
THTC,UK,uk.thtc.com (wholesale),B (DCTS),Medium,TO SEND,,,Streetwear + NGO/band white-label; hemp/cotton; makes in China now.
Synergies Worldwide,USA/India,synergiesworldwide.com (form),Agent,High,SENT,2026-07-20,2026-07-23,Large sourcing house (75+ brands). Sent via form.
Milky Fashions,Bangladesh,milkyfashions.com (form),Agent,High,SENT,2026-07-20,2026-07-23,Independent buying agent for EU/UK; London/Calgary. Sent via form.
Newtimes Group,Hong Kong,newtimesgroup.com (form),Agent,High,SENT,2026-07-20,2026-07-23,Knitwear supply to N.America/Europe brands. Sent via form.
Textiles Sourcing Ltd,Hong Kong/India,Delhi/Dhaka offices (form),Agent,Medium,SENT,2026-07-20,2026-07-23,Knit apparel for US + EU/UK importers. Sent via form.
Li & Fung,Hong Kong,lifung.com (form),Agent,Medium,SENT,2026-07-20,2026-07-23,Largest sourcing agent; knitwear vertical. Registered interest via form.
